id,Title,Authors,Source Title,Year,exclude,reason,lat,lon,elevation,city,country,human.population,human.density,GI type,GI.control,ecological.measure,intentional.species,intentional.abd,abiotic.measure,distance.greenspace,site.number,area,perimeter,height
1,"Green Cellular Networks: A Survey, Some Research Issues and Challenges","Hasan, Ziaul; Boostanimehr, Hamidreza; Bhargava, Vijay K.",IEEE COMMUNICATIONS SURVEYS AND TUTORIALS,2011,y,review,,,,,,,,,,,,,,,,,,
2,"Urban green space, public health, and environmental justice: The challenge of making cities 'just green enough'","Wolch, Jennifer R.; Byrne, Jason; Newell, Joshua P.",LANDSCAPE AND URBAN PLANNING,2014,y,review,,,,,,,,,,,,,,,,,,
3,Classifying and valuing ecosystem services for urban planning,"Gomez-Baggethun, Erik; Barton, David N.",ECOLOGICAL ECONOMICS,2013,y,economics,,,,,,,,,,,,,,,,,,
4,"Coupling biogeochemical cycles in urban environments: ecosystem services, green solutions, and misconceptions","Pataki, Diane E.; Carreiro, Margaret M.; Cherrier, Jennifer; Grulke, Nancy E.; Jennings, Viniece; Pincetl, Stephanie; Pouyat, Richard V.; Whitlow, Thomas H.; Zipperer, Wayne C.",FRONTIERS IN ECOLOGY AND THE ENVIRONMENT,2011,y,regulatory/ecosystem services,,,,,,,,,,,,,,,,,,
5,"Comprehensive concept planning of urban greening based on ecological principles: a case study in Beijing, China","Li, F; Wang, RS; Paulussen, J; Liu, XS",LANDSCAPE AND URBAN PLANNING,2005,y,city or greenspace planning,,,,,,,,,,,,,,,,,,
6,A cellular automata model of land cover change to integrate urban growth with open space conservation,"Mitsova, Diana; Shuster, William; Wang, Xinhao",LANDSCAPE AND URBAN PLANNING,2011,y,city or greenspace planning,,,,,,,,,,,,,,,,,,
7,Planning for cooler cities: A framework to prioritise green infrastructure to mitigate high temperatures in urban landscapes,"Norton, Briony A.; Coutts, Andrew M.; Livesley, Stephen J.; Harris, Richard J.; Hunter, Annie M.; Williams, Nicholas S. G.",LANDSCAPE AND URBAN PLANNING,2015,y,concept framework,,,,,,,,,,,,,,,,,,
8,Characterising the urban environment of UK cities and towns: A template for landscape planning,"Gill, Susannah E.; Handley, John F.; Ennos, A. Roland; Pauleit, Stephan; Theuray, Nicolas; Lindley, Sarah J.",LANDSCAPE AND URBAN PLANNING,2008,y,regulatory/ecosystem services,,,,,,,,,,,,,,,,,,
9,Reconnecting Cities to the Biosphere: Stewardship of Green Infrastructure and Urban Ecosystem Services,"Andersson, Erik; Barthel, Stephan; Borgstrom, Sara; Colding, Johan; Elmqvist, Thomas; Folke, Carl; Gren, Asa",AMBIO,2014,y,concept framework,,,,,,,,,,,,,,,,,,
10,"Water conservancy projects in China: Achievements, challenges and way forward","Liu, Junguo; Zang, Chuanfu; Tian, Shiying; Liu, Jianguo; Yang, Hong; Jia, Shaofeng; You, Liangzhi; Liu, Bo; Zhang, Miao",GLOBAL ENVIRONMENTAL CHANGE-HUMAN AND POLICY DIMENSIONS,2013,y,regulatory/ecosystem services,,,,,,,,,,,,,,,,,,
11,"Green justice or just green? Provision of urban green spaces in Berlin, Germany","Kabisch, Nadja; Haase, Dagmar",LANDSCAPE AND URBAN PLANNING,2014,y,social impacts,,,,,,,,,,,,,,,,,,
12,"Urban gardens, agriculture, and water management: Sources of resilience for long-term food security in cities","Barthel, Stephan; Isendahl, Christian",ECOLOGICAL ECONOMICS,2013,y,food security,,,,,,,,,,,,,,,,,,
13,Establishing green roof infrastructure through environmental policy instruments,"Carter, Timothy; Fowler, Laurie",ENVIRONMENTAL MANAGEMENT,2008,y,policy,,,,,,,,,,,,,,,,,,
14,Maryland's Green Infrastructure Assessment: Development of a comprehensive approach to land conservation,"Weber, T; Sloan, A; Wolf, J",LANDSCAPE AND URBAN PLANNING,2006,maybe,,,,,,,,,,,,,,,,,,,
15,Mitigating and adapting to climate change: Multi-functional and multi-scale assessment of green urban infrastructure,"Demuzere, M.; Orru, K.; Heidrich, O.; Olazabal, E.; Geneletti, D.; Orru, H.; Bhave, A. G.; Mittal, N.; Feliu, E.; Faehnle, M.",JOURNAL OF ENVIRONMENTAL MANAGEMENT,2014,y,regulatory/ecosystem services,,,,,,,,,,,,,,,,,,
16,Efficiency of parks in mitigating urban heat island effect: An example from Addis Ababa,"Feyisa, Gudina Legese; Dons, Klaus; Meilby, Henrik",LANDSCAPE AND URBAN PLANNING,2014,n,,9.016944,38.75222,2355,Addis ababa,Ethiopia,3.041,0.00577,Urban tree canopy,city park,tree cover,,,air cooling,,21,0.85 - 22.3 ha,,
17,Integrating conservation planning and landuse planning in urban landscapes,"Gordon, Ascelin; Simondson, David; White, Matt; Moilanen, Atte; Bekessy, Sarah Adine",LANDSCAPE AND URBAN PLANNING,2009,,,,,,,,,,,,,,,,,,,,
18,"Contribution of Ecosystem Services to Air Quality and Climate Change Mitigation Policies: The Case of Urban Forests in Barcelona, Spain","Baro, Francesc; Chaparro, Lydia; Gomez-Baggethun, Erik; Langemeyer, Johannes; Nowak, David J.; Terradas, Jaume",AMBIO,2014,,,,,,,,,,,,,,,,,,,,
19,Jaguar (Panthera onca) feeding ecology: distribution of predator and prey through time and space,"Weckel, M.; Giuliano, W.; Silver, S.",JOURNAL OF ZOOLOGY,2006,,,,,,,,,,,,,,,,,,,,
20,Urban landscape genetics: canopy cover predicts gene flow between white-footed mouse (Peromyscus leucopus) populations in New York City,"Munshi-South, Jason",MOLECULAR ECOLOGY,2012,,,,,,,,,,,,,,,,,,,,
21,From Multifunctionality to Multiple Ecosystem Services? A Conceptual Framework for Multifunctionality in Green Infrastructure Planning for Urban Areas,"Hansen, Rieke; Pauleit, Stephan",AMBIO,2014,,,,,,,,,,,,,,,,,,,,
22,Valuing green infrastructure in an urban environment under pressure - The Johannesburg case,"Schaeffler, Alexis; Swilling, Mark",ECOLOGICAL ECONOMICS,2013,,,,,,,,,,,,,,,,,,,,
23,Integrating sciences to sustain urban ecosystem services,"Lundy, L.; Wade, R.",PROGRESS IN PHYSICAL GEOGRAPHY,2011,,,,,,,,,,,,,,,,,,,,
24,SIMULATION OF COMBINED BEST MANAGEMENT PRACTICES AND LOW IMPACT DEVELOPMENT FOR SUSTAINABLE STORMWATER MANAGEMENT,"Damodaram, Chandana; Giacomoni, Marcio H.; Khedun, C. Prakash; Holmes, Hillary; Ryan, Andrea; Saour, William; Zechman, Emily M.",JOURNAL OF THE AMERICAN WATER RESOURCES ASSOCIATION,2010,,,,,,,,,,,,,,,,,,,,
25,A national assessment of green infrastructure and change for the conterminous United States using morphological image processing,"Wickham, James D.; Riitters, Kurt H.; Wade, Timothy G.; Vogt, Peter",LANDSCAPE AND URBAN PLANNING,2010,,,,,,,,,,,,,,,,,,,,
26,Perceptions of parks and urban derelict land by landscape planners and residents,"Hofmann, Mathias; Westermann, Janneke R.; Kowarik, Ingo; van der Meer, Elke",URBAN FORESTRY & URBAN GREENING,2012,,,,,,,,,,,,,,,,,,,,
27,Conserving urban biodiversity? Creating green infrastructure is only the first step,"Hostetler, Mark; Allen, Will; Meurk, Colin",LANDSCAPE AND URBAN PLANNING,2011,,,,,,,,,,,,,,,,,,,,
28,Anthropogenic Disturbance Can Determine the Magnitude of Opportunistic Species Responses on Marine Urban Infrastructures,"Airoldi, Laura; Bulleri, Fabio",PLOS ONE,2011,,,,,,,,,,,,,,,,,,,,
29,The use of economic valuation to create public support for green infrastructure investments in urban areas,"Vandermeulen, Valerie; Verspecht, Ann; Vermeire, Bert; Van Huylenbroeck, Guido; Gellynck, Xavier",LANDSCAPE AND URBAN PLANNING,2011,,,,,,,,,,,,,,,,,,,,
30,Reconceptualizing green infrastructure for climate change adaptation: Barriers to adoption and drivers for uptake by spatial planners,"Matthews, Tony; Lo, Alex Y.; Byrne, Jason A.",LANDSCAPE AND URBAN PLANNING,2015,,,,,,,,,,,,,,,,,,,,
31,Shades of Green: Measuring the Ecology of Urban Green Space in the Context of Human Health and Well-Being,"Jorgensen, Anna; Gobster, Paul H.",NATURE + CULTURE,2010,,,,,,,,,,,,,,,,,,,,
32,Urban Ecology of Shrinking Cities: An Unrecognized Opportunity?,"Haase, Dagmar",NATURE + CULTURE,2008,,,,,,,,,,,,,,,,,,,,
33,Benefits of restoring ecosystem services in urban areas,"Elmqvist, T.; Setala, H.; Handel, S. N.; van der Ploeg, S.; Aronson, J.; Blignaut, J. N.; Gomez-Baggethun, E.; Nowak, D. J.; Kronenberg, J.; de Groot, R.",CURRENT OPINION IN ENVIRONMENTAL SUSTAINABILITY,2015,,,,,,,,,,,,,,,,,,,,
34,Life cycle implications of urban green infrastructure,"Spatari, Sabrina; Yu, Ziwen; Montalto, Franco A.",ENVIRONMENTAL POLLUTION,2011,,,,,,,,,,,,,,,,,,,,
35,"Exploring ecosystem-based adaptation in Durban, South Africa: learning-by-doing at the local government coal face","Roberts, Debra; Boon, Richard; Diederichs, Nicci; Douwes, Errol; Govender, Natasha; McInnes, Alistair; McLean, Cameron; O'Donoghue, Sean; Spires, Meggan",ENVIRONMENT AND URBANIZATION,2012,,,,,,,,,,,,,,,,,,,,
36,Protecting Forest Areas for Biodiversity in Sweden 1991-2010: the Policy Implementation Process and Outcomes on the Ground,"Angelstam, Per; Andersson, Kjell; Axelsson, Robert; Elbakidze, Marine; Jonsson, Bengt Gunnar; Roberge, Jean-Michel",SILVA FENNICA,2011,,,,,,,,,,,,,,,,,,,,
37,Advancing Urban Ecology toward a Science of Cities,"McPhearson, Timon; Pickett, Steward T. A.; Grimm, Nancy B.; Niemela, Jari; Alberti, Marina; Elmqvist, Thomas; Weber, Christiane; Haase, Dagmar; Breuste, Juergen; Qureshi, Salman",BIOSCIENCE,2016,,,,,,,,,,,,,,,,,,,,
38,Civic ecology practices: Participatory approaches to generating and measuring ecosystem services in cities,"Krasny, Marianne E.; Russ, Alex; Tidball, Keith G.; Elmqvist, Thomas",ECOSYSTEM SERVICES,2014,,,,,,,,,,,,,,,,,,,,
39,Green roofs as habitats for wild plant species in urban landscapes: First insights from a large-scale sampling,"Madre, Frederic; Vergnes, Alan; Machon, Nathalie; Clergeau, Philippe",LANDSCAPE AND URBAN PLANNING,2014,,,,,,,,,,,,,,,,,,,,
40,"Exploring the production capacity of rooftop gardens (RTGs) in urban agriculture: the potential impact on food and nutrition security, biodiversity and other ecosystem services in the city of Bologna","Orsini, Francesco; Gasperi, Daniela; Marchetti, Livia; Piovene, Chiara; Draghetti, Stefano; Ramazzotti, Solange; Bazzocchi, Giovanni; Gianquinto, Giorgio",FOOD SECURITY,2014,,,,,,,,,,,,,,,,,,,,
41,Do green roofs help urban biodiversity conservation?,"Williams, Nicholas S. G.; Lundholm, Jeremy; MacIvor, J. Scott",JOURNAL OF APPLIED ECOLOGY,2014,,,,,,,,,,,,,,,,,,,,
42,A social-ecological assessment of vacant lots in New York City,"Kremer, Peleg; Hamstead, Zoe A.; McPhearson, Timon",LANDSCAPE AND URBAN PLANNING,2013,,,,,,,,,,,,,,,,,,,,
43,Multifunctionality of floodplain landscapes: relating management options to ecosystem services,"Schindler, Stefan; Sebesvari, Zita; Damm, Christian; Euller, Katrin; Mauerhofer, Volker; Schneidergruber, Anna; Biro, Marianna; Essl, Franz; Kanka, Robert; Lauwaars, Sophie G.; Schulz-Zunkel, Christiane; van der Sluis, Theo; Kropik, Michaela; Gasso, Viktor; Krug, Andreas; Pusch, Martin T.; Zulka, Klaus Peter; Lazowski, Werner; Hainz-Renetzeder, Christa; Henle, Klaus; Wrbka, Thomas",LANDSCAPE ECOLOGY,2014,,,,,,,,,,,,,,,,,,,,
44,Transitioning to resilience and sustainability in urban communities,"Collier, Marcus J.; Nedovic-Budic, Zorica; Aerts, Jeroen; Connop, Stuart; Foley, Dermot; Foley, Karen; Newport, Darryl; McQuaid, Siobhan; Slaev, Aleksander; Verburg, Peter",CITIES,2013,,,,,,,,,,,,,,,,,,,,
45,Planting the Living City Best Practices in Planning Green Infrastructure-Results From Major U.S. Cities,"Young, Robert F.",JOURNAL OF THE AMERICAN PLANNING ASSOCIATION,2011,,,,,,,,,,,,,,,,,,,,
46,"Land use change and causes in the Xiangxi catchment, Three Gorges Area derived from multispectral data","Seeber, Christoph; Hartmann, Heike; Wei, Xiang; King, Lorenz",JOURNAL OF EARTH SCIENCE,2010,,,,,,,,,,,,,,,,,,,,
47,"Urban vacancy and land use legacies: A frontier for urban ecological research, design, and planning","Nassauer, Joan Iverson; Raskin, Julia",LANDSCAPE AND URBAN PLANNING,2014,,,,,,,,,,,,,,,,,,,,
48,Governing metropolitan green infrastructure in the United States,"Young, Robert F.; McPherson, E. Gregory",LANDSCAPE AND URBAN PLANNING,2013,,,,,,,,,,,,,,,,,,,,
49,"Nature, urban development and sustainability - What new elements are needed for a more comprehensive understanding?","Pincetl, Stephanie",CITIES,2012,,,,,,,,,,,,,,,,,,,,
50,Can satellite-based night lights be used for conservation? The case of nesting sea turtles in the Mediterranean,"Mazor, Tessa; Levin, Noam; Possingham, Hugh P.; Levy, Yaniv; Rocchini, Duccio; Richardson, Anthony J.; Kark, Salit",BIOLOGICAL CONSERVATION,2013,,,,,,,,,,,,,,,,,,,,
51,Modelling the spatial distribution of linear landscape elements in Europe,"van der Zanden, Emma H.; Verburg, Peter H.; Mucher, Caspar A.",ECOLOGICAL INDICATORS,2013,,,,,,,,,,,,,,,,,,,,
52,Producing edible landscapes in Seattle's urban forest,"McLain, Rebecca; Poe, Melissa; Hurley, Patrick T.; Lecompte-Mastenbrook, Joyce; Emery, Marla R.",URBAN FORESTRY & URBAN GREENING,2012,,,,,,,,,,,,,,,,,,,,
53,The alignment of agricultural and nature conservation policies in the European Union,"Hodge, Ian; Hauck, Jennifer; Bonn, Aletta",CONSERVATION BIOLOGY,2015,,,,,,,,,,,,,,,,,,,,
54,Using expert knowledge in combining green infrastructure and ecosystem services in land use planning: an insight into a new place-based methodology,"Kopperoinen, Leena; Itkonen, Pekka; Niemela, Jari",LANDSCAPE ECOLOGY,2014,,,,,,,,,,,,,,,,,,,,
55,Perspectives on the Use of Green Infrastructure for Stormwater Management in Cleveland and Milwaukee,"Keeley, Melissa; Koburger, Althea; Dolowitz, David P.; Medearis, Dale; Nickel, Darla; Shuster, William",ENVIRONMENTAL MANAGEMENT,2013,,,,,,,,,,,,,,,,,,,,
56,Natural forest expansion into suburban countryside: Gained ground for a green infrastructure?,"Barbati, Anna; Corona, Piermaria; Salvati, Luca; Gasparella, Lorenza",URBAN FORESTRY & URBAN GREENING,2013,,,,,,,,,,,,,,,,,,,,
57,Water security: Gray or green?,"Palmer, Margaret A.; Liu, Junguo; Matthews, John H.; Mumba, Musonda; D'Odorico, Paolo",SCIENCE,2015,,,,,,,,,,,,,,,,,,,,
58,Outstanding challenges for urban conservation research and action,"Shwartz, Assaf; Turbe, Anne; Julliard, Romain; Simon, Laurent; Prevot, Anne-Caroline",GLOBAL ENVIRONMENTAL CHANGE-HUMAN AND POLICY DIMENSIONS,2014,,,,,,,,,,,,,,,,,,,,
59,Mismatches between ecosystem services supply and demand in urban areas: A quantitative assessment in five European cities,"Baro, Francesc; Haase, Dagmar; Gomez-Baggethun, Erik; Frantzeskaki, Niki",ECOLOGICAL INDICATORS,2015,,,,,,,,,,,,,,,,,,,,
60,Ecosystem services of urban green spaces in African countries-perspectives and challenges,"Cilliers, Sarel; Cilliers, Juanee; Lubbe, Rina; Siebert, Stefan",URBAN ECOSYSTEMS,2013,,,,,,,,,,,,,,,,,,,,
61,Challenges and future directions in urban afforestation,"Oldfield, Emily E.; Warren, Robert J.; Felson, Alexander J.; Bradford, Mark A.",JOURNAL OF APPLIED ECOLOGY,2013,,,,,,,,,,,,,,,,,,,,
62,Local levers for change: Mainstreaming ecosystem-based adaptation into municipal planning to foster sustainability transitions,"Wamsler, Christine; Luederitz, Christopher; Brink, Ebba",GLOBAL ENVIRONMENTAL CHANGE-HUMAN AND POLICY DIMENSIONS,2014,,,,,,,,,,,,,,,,,,,,
63,Using Life Cycle Assessment to Evaluate Green and Grey Combined Sewer Overflow Control Strategies,"De Sousa, Maria R. C.; Montalto, Franco A.; Spatari, Sabrina",JOURNAL OF INDUSTRIAL ECOLOGY,2012,,,,,,,,,,,,,,,,,,,,
64,Cultural ecosystem services as a gateway for improving urban sustainability,"Andersson, Erik; Tengo, Maria; McPhearson, Timon; Kremer, Peleg",ECOSYSTEM SERVICES,2015,,,,,,,,,,,,,,,,,,,,
65,More green infrastructure is required to maintain ecosystem services under current trends in land-use change in Europe,"Maes, Joachim; Barbosa, Ana; Baranzelli, Claudia; Zulian, Grazia; Batista e Silva, Filipe; Vandecasteele, Ine; Hiederer, Roland; Liquete, Camino; Paracchini, Maria Luisa; Mubareka, Sarah; Jacobs-Crisioni, Chris; Castillo, Carolina Perpina; Lavalle, Carlo",LANDSCAPE ECOLOGY,2015,,,,,,,,,,,,,,,,,,,,
66,Agriculture and the city: A method for sustainable planning of new forms of agriculture in urban contexts,"La Rosa, Daniele; Barbarossa, Luca; Privitera, Riccardo; Martinico, Francesco",LAND USE POLICY,2014,,,,,,,,,,,,,,,,,,,,
67,Residential demolition and its impact on vacant lot hydrology: Implications for the management of stormwater and sewer system overflows,"Shuster, W. D.; Dadio, S.; Drohan, P.; Losco, R.; Shaffer, J.",LANDSCAPE AND URBAN PLANNING,2014,,,,,,,,,,,,,,,,,,,,
68,Negotiating value and priorities: evaluating the demands of green infrastructure development,"Roe, Maggie; Mell, Ian",JOURNAL OF ENVIRONMENTAL PLANNING AND MANAGEMENT,2013,,,,,,,,,,,,,,,,,,,,
69,Spatial contagion: Gardening along the street in residential neighborhoods,"Hunter, Mary Carol R.; Brown, Daniel G.",LANDSCAPE AND URBAN PLANNING,2012,,,,,,,,,,,,,,,,,,,,
70,Assessing Equitable Access to Urban Green Space: The Role of Engineered Water Infrastructure,"Wendel, Heather E. Wright; Downs, Joni A.; Mihelcic, James R.",ENVIRONMENTAL SCIENCE & TECHNOLOGY,2011,,,,,,,,,,,,,,,,,,,,
71,Green structure and planning evolution in Porto,"Madureira, Helena; Andresen, Teresa; Monteiro, Ana",URBAN FORESTRY & URBAN GREENING,2011,,,,,,,,,,,,,,,,,,,,
72,Assessing climate-adaptation effect of extensive tropical green roofs in cities,"Jim, C. Y.",LANDSCAPE AND URBAN PLANNING,2015,,,,,,,,,,,,,,,,,,,,
73,"Greening the urban frontier: Race, property, and resettlement in Detroit","Safransky, Sara",GEOFORUM,2014,,,,,,,,,,,,,,,,,,,,
74,"Sinners, scapegoats or fashion victims? Understanding the deaths of trees in the green city","Kirkpatrick, James B.; Davison, Aidan; Daniels, Grant D.",GEOFORUM,2013,,,,,,,,,,,,,,,,,,,,
75,"Solving Problems in Social-Ecological Systems: Definition, Practice and Barriers of Transdisciplinary Research","Angelstam, Per; Andersson, Kjell; Annerstedt, Matilda; Axelsson, Robert; Elbakidze, Marine; Garrido, Pablo; Grahn, Patrik; Jonsson, K. Ingemar; Pedersen, Simen; Schlyter, Peter; Skarback, Erik; Smith, Mike; Stjernquist, Ingrid",AMBIO,2013,,,,,,,,,,,,,,,,,,,,
76,Characterization of non-urbanized areas for land-use planning of agricultural and green infrastructure in urban contexts,"La Rosa, Daniele; Privitera, Riccardo",LANDSCAPE AND URBAN PLANNING,2013,,,,,,,,,,,,,,,,,,,,
77,"Peoples' use of, and concerns about, green space networks: A case study of Birchwood, Warrington New Town, UK","Tzoulas, Konstantinos; James, Philip",URBAN FORESTRY & URBAN GREENING,2010,,,,,,,,,,,,,,,,,,,,
78,"Mitigating the Water Footprint of Export Cut Flowers from the Lake Naivasha Basin, Kenya","Mekonnen, M. M.; Hoekstra, A. Y.; Becht, R.",WATER RESOURCES MANAGEMENT,2012,,,,,,,,,,,,,,,,,,,,
79,Design for the next generation incorporating cradle-to-cradle design into Herman Miller products,"Rossi, Mark; Charon, Scott; Wing, Gabe; Ewell, James",JOURNAL OF INDUSTRIAL ECOLOGY,2006,,,,,,,,,,,,,,,,,,,,
80,Identifying priority sites for low impact development (LID) in a mixed-use watershed,"Martin-Mikle, Chelsea J.; de Beurs, Kirsten M.; Julian, Jason P.; Mayer, Paul M.",LANDSCAPE AND URBAN PLANNING,2015,,,,,,,,,,,,,,,,,,,,
81,Economic Feasibility of Recycling Photovoltaic Modules,"Choi, Jun-Ki; Fthenakis, Vasilis",JOURNAL OF INDUSTRIAL ECOLOGY,2010,,,,,,,,,,,,,,,,,,,,
82,Susceptibility of non-indigenous ascidian species in British Columbia (Canada) to invertebrate predation,"Epelbaum, A.; Pearce, C. M.; Barker, D. J.; Paulson, A.; Therriault, T. W.",MARINE BIOLOGY,2009,,,,,,,,,,,,,,,,,,,,
83,Mapping green infrastructure based on ecosystem services and ecological networks: A Pan-European case study,"Liquete, Camino; Kleeschulte, Stefan; Dige, Gorm; Maes, Joachim; Grizzetti, Bruna; Olah, Branislav; Zulian, Grazia",ENVIRONMENTAL SCIENCE & POLICY,2015,,,,,,,,,,,,,,,,,,,,
84,Freshwater ecosystem services supporting humans: Pivoting from water crisis to water solutions,"Green, Pamela A.; Voeroesmarty, Charles J.; Harrison, Ian; Farrell, Tracy; Saenz, Leonard; Fekete, Balazs M.",GLOBAL ENVIRONMENTAL CHANGE-HUMAN AND POLICY DIMENSIONS,2015,,,,,,,,,,,,,,,,,,,,
85,Exploring biodiversity in a metropolitan area in the Mediterranean region: The urban and suburban flora of Rome (Italy),"Capotorti, G.; Del Vico, E.; Lattanzi, E.; Tilia, A.; Celesti-Grapow, L.",PLANT BIOSYSTEMS,2013,,,,,,,,,,,,,,,,,,,,
86,Green infrastructures and intensive forestry: Need and opportunity for spatial planning in a Swedish rural-urban gradient,"Andersson, Kjell; Angelstam, Per; Elbakidze, Marine; Axelsson, Robert; Degerman, Erik",SCANDINAVIAN JOURNAL OF FOREST RESEARCH,2013,,,,,,,,,,,,,,,,,,,,
87,Agricultural and green infrastructures: The role of non-urbanised areas for eco-sustainable planning in a metropolitan region,"La Greca, Paolo; La Rosa, Daniele; Martinico, Francesco; Privitera, Riccardo",ENVIRONMENTAL POLLUTION,2011,,,,,,,,,,,,,,,,,,,,
88,Urban wildscapes and green spaces in Mombasa and their potential contribution to climate change adaptation and mitigation,"Kithiia, Justus; Lyth, Anna",ENVIRONMENT AND URBANIZATION,2011,,,,,,,,,,,,,,,,,,,,
89,Ecosystem-based adaptation in cities: An analysis of European urban climate adaptation plans,"Geneletti, Davide; Zardo, Linda",LAND USE POLICY,2016,,,,,,,,,,,,,,,,,,,,
90,Understanding the value of urban riparian corridors: Considerations in planning for cultural services along an Indonesian river,"Vollmer, Derek; Prescott, Michaela F.; Padawangi, Rita; Girot, Christophe; Gret-Regamey, Adrienne",LANDSCAPE AND URBAN PLANNING,2015,,,,,,,,,,,,,,,,,,,,
91,Multiple benefits and values of trees in urban landscapes in two towns in northern South Africa,"Shackleton, Sheona; Chinyimba, Abby; Hebinck, Paul; Shackleton, Charlie; Kaoma, Humphrey",LANDSCAPE AND URBAN PLANNING,2015,,,,,,,,,,,,,,,,,,,,
92,Planning support system for climate adaptation: Composing effective sets of blue-green measures to reduce urban vulnerability to extreme weather events,"Voskamp, I. M.; Van de Ven, F. H. M.",BUILDING AND ENVIRONMENT,2015,,,,,,,,,,,,,,,,,,,,
93,A comparison of the economic benefits of urban green spaces estimated with NDVI and with high-resolution land cover data,"Li, Wei; Saphores, Jean-Daniel M.; Gillespie, Thomas W.",LANDSCAPE AND URBAN PLANNING,2015,,,,,,,,,,,,,,,,,,,,
94,Structural Diversity: A Multi-dimensional Approach to Assess Recreational Services in Urban Parks,"Voigt, Annette; Kabisch, Nadja; Wurster, Daniel; Haase, Dagmar; Breuste, Juergen",AMBIO,2014,,,,,,,,,,,,,,,,,,,,
95,Gray vs. green urbanization: Relative importance of urban features for urban bird communities,"MacGregor-Fors, Ian; Schondube, Jorge E.",BASIC AND APPLIED ECOLOGY,2011,,,,,,,,,,,,,,,,,,,,
96,A New Approach in Measuring Rainfall Interception by Urban Trees in Coastal British Columbia,"Asadian, Yeganeh; Weiler, Markus",WATER QUALITY RESEARCH JOURNAL OF CANADA,2009,,,,,,,,,,,,,,,,,,,,
97,Mainstreaming ecosystem-based adaptation: transformation toward sustainability in urban governance and planning,"Wamsler, Christine",ECOLOGY AND SOCIETY,2015,,,,,,,,,,,,,,,,,,,,
98,Growth of Native Aromatic Xerophytes in an Extensive Mediterranean Green Roof as Affected by Substrate Type and Depth and Irrigation Frequency,"Papafotiou, Maria; Pergialioti, Niki; Tassoula, Lamprini; Massas, Ioannis; Kargas, Georgios",HORTSCIENCE,2013,,,,,,,,,,,,,,,,,,,,
99,The overlooked role of biotic factors in controlling the ecological performance of artificial marine habitats,"Ferrario, Filippo; Ivesa, Ljiljana; Jaklin, Andrej; Perkol-Finkel, Shimrit; Airoldi, Laura",JOURNAL OF APPLIED ECOLOGY,2016,,,,,,,,,,,,,,,,,,,,
100,Effective green equivalent-A measure of public green spaces for cities,"Yao, Liang; Liu, Jingru; Wang, Rusong; Yin, Ke; Han, Baolong",ECOLOGICAL INDICATORS,2014,,,,,,,,,,,,,,,,,,,,
101,Using green infrastructure for urban climate-proofing: An evaluation of heat mitigation measures at the micro-scale,"Zoelch, Teresa; Maderspacher, Johannes; Wamsler, Christine; Pauleit, Stephan",URBAN FORESTRY & URBAN GREENING,2016,,,,,,,,,,,,,,,,,,,,
102,Urban residents' beliefs concerning green space benefits in four cities in France and Portugal,"Madureira, Helena; Nunes, Fernando; Oliveira, Jose Vidal; Cormier, Laure; Madureira, Teresa",URBAN FORESTRY & URBAN GREENING,2015,,,,,,,,,,,,,,,,,,,,
103,Rivers as municipal infrastructure: Demand for environmental services in informal settlements along an Indonesian river,"Vollmer, Derek; Gret-Regamey, Adrienne",GLOBAL ENVIRONMENTAL CHANGE-HUMAN AND POLICY DIMENSIONS,2013,,,,,,,,,,,,,,,,,,,,
104,Decoupling factors affecting plant diversity and cover on extensive green roofs,"MacIvor, J. Scott; Margolis, Liat; Puncher, Curtis L.; Matthews, Benjamin J. Carver",JOURNAL OF ENVIRONMENTAL MANAGEMENT,2013,,,,,,,,,,,,,,,,,,,,
105,Ecological disturbances due to high cutback in the green infrastructure of Karachi: Analyses of public perception about associated health problems,"Qureshi, Salman; Kazmi, Syed Jamil Hasan; Breuste, Juergen H.",URBAN FORESTRY & URBAN GREENING,2010,,,,,,,,,,,,,,,,,,,,
106,Green reconstruction of the tsunami-affected areas in India using the integrated coastal zone management concept,"Sonak, Sangeeta; Pangam, Prajwala; Giriyan, Asha",JOURNAL OF ENVIRONMENTAL MANAGEMENT,2008,,,,,,,,,,,,,,,,,,,,
107,Infrastructure networks and red-green patterns in city regions,"Schrijnen, PM",LANDSCAPE AND URBAN PLANNING,2000,,,,,,,,,,,,,,,,,,,,
108,"Ecosystem services provided by urban gardens in Barcelona, Spain: Insights for policy and planning","Camps-Calvet, Marta; Langemeyer, Johannes; Calvet-Mir, Laura; Gomez-Baggethun, Erik",ENVIRONMENTAL SCIENCE & POLICY,2016,,,,,,,,,,,,,,,,,,,,
109,The role of urban green infrastructure in offsetting carbon emissions in 35 major Chinese cities: A nationwide estimate,"Chen, Wendy Y.",CITIES,2015,,,,,,,,,,,,,,,,,,,,
110,Integrating community gardens into public parks: An innovative approach for providing ecosystem services in urban areas,"Middle, Isaac; Dzidic, Peta; Buckley, Amma; Bennett, Dawn; Tye, Marian; Jones, Roy",URBAN FORESTRY & URBAN GREENING,2014,,,,,,,,,,,,,,,,,,,,
